File	Relation	SNum	Sentence
EBA1415_TRJA_11_SC_ES-05708	R-3-4	1573	Uvb is a type of radiation that can cause small amounts of damage to the skin.
EBA1415_TRJA_11_SC_ES-05708	R-11-12	1574.1	Melanin protects from the sun even though it would not typically help with the cause of sunburn.
EBA1415_TRJA_11_SC_ES-05708	R-12-2	1574.2	Melanin protects from the sun even though it would not typically help with the cause of sunburn.
EBA1415_TRJA_11_SC_ES-05708	R-5-4	1575	When sunburn occur it damage the genetic molecules, to turn the blood red on to the skin.
EBA1415_TRJA_11_SC_ES-05708	O	1576	That is what orginally happens.//
EBA1415_WSKT_1_SC_ES-05324	O	1577	Differences that lead to a risk of developing skin cancer aren't very difficult to grasp.
EBA1415_WSKT_1_SC_ES-05324	R-1-2	1578	A few examples are your location on earth, and how hard the sun hits that specific location.
EBA1415_WSKT_1_SC_ES-05324	R-2-50	1579	UVb radiation exposure ties into that as well, even your time out in the sun could influence your chances of developing skin cancer./
EBA1415_WSKT_1_SC_ES-05324	O	1580	In the documents there were various references to location.
EBA1415_WSKT_1_SC_ES-05324	R-1-2	1581.1	",the closer you are to the equator, the more consistent direct sunlight the higher the chances of getting skin cancer./
EBA1415_WSKT_1_SC_ES-05324	R-2-50	1581.2	",the closer you are to the equator, the more consistent direct sunlight the higher the chances of getting skin cancer./
EBA1415_WSKT_1_SC_ES-05324	O	1582	It all goes back to UvB radiation- The skin cells can onyl fix some damages, if it's a consistent occurence it can produce a problem for us.
EBA1415_WSKT_1_SC_ES-05324	O	1583	Although some may live in places where direct sunlight isn't a year round occurence it still presents a problem, just seasonal.
EBA1415_WSKT_1_SC_ES-05324	R-1-50	1584	The graph shows decline in skin cancer as latitude distance from the equator increases- but it doesn't eliminate all cases.
EBA1415_WSKT_1_SC_ES-05324	R-1-50	1585	Therefore South American countries are more at risk than the U.S. or Northern countries./
EBA1415_WSKT_1_SC_ES-05324	R-2-3	1586	Even tanning or going out in the sun can produce UvB radiation.
EBA1415_WSKT_1_SC_ES-05324	R-5-6	1587.1	When you get a sunburn molecules in your sun go and fix the damaged cells- it could be simple if it's a mild burn, however if its a severe burn, chances are some cells will not be fixed- leaving amounts of radiation in yuor skin- just one bad case of sunburn can double your chances of getting skin cancer./
EBA1415_WSKT_1_SC_ES-05324	R-5-50	1587.2	When you get a sunburn molecules in your sun go and fix the damaged cells- it could be simple if it's a mild burn, however if its a severe burn, chances are some cells will not be fixed- leaving amounts of radiation in yuor skin- just one bad case of sunburn can double your chances of getting skin cancer./
EBA1415_WSKT_1_SC_ES-05324	R-3-50	1588	With the various ideas expressed in the article it all rotates around UvB radiation, the more you & your skin is exposed to it the more chances there are of you developing a case of skin cancer there are.//
EBA1415_SDLC_2_SC_ES-06283	O	1589	Skin cancer is the uncontrolled growth of abnormal skin cells.
EBA1415_SDLC_2_SC_ES-06283	O	1590	Which skin cancer is developed depends on the type of skin cell that reproduces irregularly.
EBA1415_SDLC_2_SC_ES-06283	O	1591	There are three variaties of skin cancer; basal cell caricnoma, squamous cell carcinoma, and malignant melanoma.
EBA1415_SDLC_2_SC_ES-06283	O	1592	If you are closer to the equator you need to be more aware about the dangers from sunlight.
EBA1415_SDLC_2_SC_ES-06283	R-3-4	1593	UVb radiation can cause small damage to genetic molecules in the skin cells.
EBA1415_SDLC_2_SC_ES-06283	R-5-50	1594.1	Sunburns can cause skin cancer, sunburned skin cells that aren't removed can result in skin cnacer.
EBA1415_SDLC_2_SC_ES-06283	R-5-6	1594.2	Sunburns can cause skin cancer, sunburned skin cells that aren't removed can result in skin cnacer.
EBA1415_SDLC_2_SC_ES-06283	R-6-50	1594.3	Sunburns can cause skin cancer, sunburned skin cells that aren't removed can result in skin cnacer.
EBA1415_SDLC_2_SC_ES-06283	O	1595	Usually abnormal or damaged cells are cleared away and replaced with new ones./
EBA1415_SDLC_2_SC_ES-06283	R-5-6	1596	If sunburn is severe enough it becomes less likely that all damaged skin cells will be removed.
EBA1415_SDLC_2_SC_ES-06283	R-5-50	1597	Chances for skin cancer doubles if you had serious sunburn in childhood or if a person has five or more sunburns at any age.//
EBA1415_TWDG_11_SC_ES-04948	O	1598	The reason behind most skin cancer is do to the type of skin cell that reproduces irregularly.
EBA1415_TWDG_11_SC_ES-04948	O	1599	In the text a cell called malignant melanoma is responsible for the most deaths from cancer.//
EBA1415_TWDG_11_SC_ES-05462	O	1600	My paper was about skin damage and you may not know that the skin is the largest organ on the human body.
EBA1415_TWDG_11_SC_ES-05462	O	1601	The skin covers every region of the body.
EBA1415_TWDG_11_SC_ES-05462	O	1602	Our skin helps us regulate our body tempature.
EBA1415_TWDG_11_SC_ES-05462	O	1603	But some of us may take something for granted such as our skin and thats something that helps us out very much without the skin our body would loose most of its water and you could have a good chance of infection in the body.
EBA1415_TWDG_11_SC_ES-05462	O	1604	The human body is like a open cut or a open lasceraction on the body which can get infected.
EBA1415_TWDG_11_SC_ES-05462	O	1605	Severe sunburn is one good example of infection, not all people with sunburn get the infection right off the back.
EBA1415_TWDG_11_SC_ES-05462	R-5-50	1606	It depends on how bad your sunburn really is (for example (if the sunburn is severely brused and peeled skin and really red its a chance you could have the infection.
EBA1415_TWDG_11_SC_ES-05462	O	1607	The ifection doesn't always come tho.
EBA1415_TWDG_11_SC_ES-05462	O	1608	It all depends on how bad the burn is.
EBA1415_TWDG_11_SC_ES-05462	O	1609	Skin cancer causes serious skin disorders.
EBA1415_TWDG_11_SC_ES-05462	R-1-2	1610.1	If you live closer to the equator thats were the sun shines more bright at so you could get it there.
EBA1415_TWDG_11_SC_ES-05462	R-2-50	1610.2	If you live closer to the equator thats were the sun shines more bright at so you could get it there.
EBA1415_TWDG_11_SC_ES-05462	R-1-50	1611	Or if you don't live close to the equator you could still get skin cancer but you'll have a less chance of it.//
EBA1415_TTKP_7-8_SC_ES-04915	O	1612	There are a many ways to develop skin cancer.
EBA1415_TTKP_7-8_SC_ES-04915	R-2-50	1613	You can develop skin cancer by not keeping your skin clean, or even playing in the hot radiant sun for to long.
EBA1415_TTKP_7-8_SC_ES-04915	O	1614	If you don't stay outside for longer than six hours a day you should be fine.
EBA1415_TTKP_7-8_SC_ES-04915	R-2-50	1615	I believe you shouldn't be outside until it starts cooling down.
EBA1415_TTKP_7-8_SC_ES-04915	R-2-50	1616	By doing this not only will you have a lower chance of overheating or getting too hot but you will also have a lower chance of developing skin cancer.
EBA1415_TTKP_7-8_SC_ES-04915	O	1617	If you check your body and see anything unusual it is best that you contact you doctor immediately because you could be showing early signs of skin cancer.
EBA1415_TTKP_7-8_SC_ES-04915	O	1618	I treated in time there is a posiblity that your doctor can stop the cancer from spreading.
EBA1415_TTKP_7-8_SC_ES-04915	R-2-50	1619.1	You are more likely to get skin cancer if you live in the southern areas where the temperature can be hovering over and around 100o Faranheit.
EBA1415_TTKP_7-8_SC_ES-04915	R-1-2	1619.2	You are more likely to get skin cancer if you live in the southern areas where the temperature can be hovering over and around 100o Faranheit.
EBA1415_TTKP_7-8_SC_ES-04915	O	1620	It is best to protect your body with SPF 100 sun block when having fun in the sun.
EBA1415_TTKP_7-8_SC_ES-04915	O	1621	It is not good to sue tanning machines because all the radiation in the machine could kill your cells.
EBA1415_TTKP_7-8_SC_ES-04915	O	1622	It is good to get vitamin D but too much vitamin D can rise your risk of developing skin cancer.
EBA1415_TTKP_7-8_SC_ES-04915	O	1623	Stay inside when it's going to be sweltering hot outside.//
EBA1415_KYLS_6_SC_ES-05675	R-2-50	1624.1	The causes for skin cancer are; the amount of sun you get, the amount of cells reproduced irregularly, types of cell, uvb radiation, sunburned skin cells that aren't removed can result in skin cancer too, also known as the amount of damaged genetic molecules that you have./
EBA1415_KYLS_6_SC_ES-05675	R-3-50	1624.2	The causes for skin cancer are; the amount of sun you get, the amount of cells reproduced irregularly, types of cell, uvb radiation, sunburned skin cells that aren't removed can result in skin cancer too, also known as the amount of damaged genetic molecules that you have./
EBA1415_KYLS_6_SC_ES-05675	R-6-50	1624.3	The causes for skin cancer are; the amount of sun you get, the amount of cells reproduced irregularly, types of cell, uvb radiation, sunburned skin cells that aren't removed can result in skin cancer too, also known as the amount of damaged genetic molecules that you have./
EBA1415_KYLS_6_SC_ES-05675	R-1-2	1625	One of the causes of skin cancer is; the amount of sun that you get depending of the place that you live in.
EBA1415_KYLS_6_SC_ES-05675	O	1626	This means that people closer to the equator need to be more aware of the dangers of direct sunlight, althought there is still sun exposure wherever you live & at anytime of the year./
EBA1415_KYLS_6_SC_ES-05675	R-3-50	1627.1	Another cause for skin cancer is the uvb radiation that also goes with the amount of sun that you get because the more direct sunlight that you get the more uvb radiation, that means you make more vitamin D which would give you less protection against uvb radiation./
EBA1415_KYLS_6_SC_ES-05675	R-2-3	1627.2	Another cause for skin cancer is the uvb radiation that also goes with the amount of sun that you get because the more direct sunlight that you get the more uvb radiation, that means you make more vitamin D which would give you less protection against uvb radiation./
EBA1415_KYLS_6_SC_ES-05675	R-12-3	1627.3	Another cause for skin cancer is the uvb radiation that also goes with the amount of sun that you get because the more direct sunlight that you get the more uvb radiation, that means you make more vitamin D which would give you less protection against uvb radiation./
EBA1415_KYLS_6_SC_ES-05675	R-5-50	1628.1	Sunburned skin cells also have a great role in the cause of skin cancer because the amount of genetic molecules can be used as an indicator of sunburn severity.
EBA1415_KYLS_6_SC_ES-05675	R-4-5	1628.2	Sunburned skin cells also have a great role in the cause of skin cancer because the amount of genetic molecules can be used as an indicator of sunburn severity.
EBA1415_KYLS_6_SC_ES-05675	R-5-6	1629.1	Which also means that sunburned skin cells that aren't removed can result in skin cancer.
EBA1415_KYLS_6_SC_ES-05675	R-6-50	1629.2	Which also means that sunburned skin cells that aren't removed can result in skin cancer.
EBA1415_KYLS_6_SC_ES-05675	O	1630	In some ocassions severe sunburns, sun poisoning, can lead to death./
EBA1415_KYLS_6_SC_ES-05675	O	1631	Along with sunburns, irregular reproduction of/
EBA1415_KYLS_6_SC_ES-05675	O	1632	Ran out of time!//
EBA1415_SVJJ_4_SC-05633	O	1633	What leads to the differences in the rates of coral bleaching is coral bleaching is a phenomenon in which coral loses it's color.
EBA1415_SVJJ_4_SC-05633	O	1634	ran out of time //
EBA1415_RDCS_1_SC_ES-04702	O	1635	One risk in developing skin cancer is the more closer you are to the equator, the more aware of direct sunlight.
EBA1415_RDCS_1_SC_ES-04702	R-1-2	1636	If you live where there is less sunlight.
EBA1415_RDCS_1_SC_ES-04702	O	1637	You don't have to worry that much when living closer to the equator.
EBA1415_RDCS_1_SC_ES-04702	O	1638	But you still have to be aware no matter where you live.
EBA1415_RDCS_1_SC_ES-04702	O	1639	Another risk is even though your skin protects you, it can't protect you all the time.
EBA1415_RDCS_1_SC_ES-04702	O	1640	Studies of humans have demonstrated harmful effects of exposure to uvb radiation.
EBA1415_RDCS_1_SC_ES-04702	R-3-4	1641	It is a type of solar radiation when the skin is hit with uvb.
EBA1415_RDCS_1_SC_ES-04702	R-3-4	1642	It causes damage to skin cells.
EBA1415_RDCS_1_SC_ES-04702	R-3-4	1643	Are body is good at repairing the damage but couldstill damage when there is excessive exposure to uvb.
EBA1415_RDCS_1_SC_ES-04702	R-5-4	1644	Last reason is sunburn which can damage genetic molecules in skin cells.
EBA1415_RDCS_1_SC_ES-04702	R-5-6	1645	Sunburned skin cells that are not removed can skin cancer.
EBA1415_RDCS_1_SC_ES-04702	O	1646	Normally damaged cells are cleared away and replaced with new cells, but this doesn't always happen.
EBA1415_RDCS_1_SC_ES-04702	R-5-50	1647	One having a sunburn in childhood can develop skin cancer later in life.//
EBA1415_SDLC_8_SC_ES-06284	R-2-50	1648.1	There are many ways of developing skin cancer like latitude, UV radiation, & the amount of exposure to sunlight.
EBA1415_SDLC_8_SC_ES-06284	R-3-50	1648.2	There are many ways of developing skin cancer like latitude, UV radiation, & the amount of exposure to sunlight.
EBA1415_SDLC_8_SC_ES-06284	R-1-50	1648.3	There are many ways of developing skin cancer like latitude, UV radiation, & the amount of exposure to sunlight.
EBA1415_SDLC_8_SC_ES-06284	R-1-50	1649	The closer someone is to the equator, the bigger the chance of them getting skin cancer.
EBA1415_SDLC_8_SC_ES-06284	R-1-2	1650.1	When around the equator, there is more direct sunlight towards it, making their chances of skin cancer increase.
EBA1415_SDLC_8_SC_ES-06284	R-2-50	1650.2	When around the equator, there is more direct sunlight towards it, making their chances of skin cancer increase.
EBA1415_SDLC_8_SC_ES-06284	R-3-50	1651	When there is excessive exposure to Ultraviolet Radiation, one's chances of getting skin cancer may increase.
EBA1415_SDLC_8_SC_ES-06284	R-3-4	1652	According to the article "Your skin protects you" it says "Using both human skin cells & a mouse model, researchers have been able to find that when the skin is hit with normal amounts of UVb radiation, the rays cause small amounts of damage to genetic molecules in skin cells.
EBA1415_SDLC_8_SC_ES-06284	R-3-4	1653	This shows that the more exposure the more severe the damage can be.
EBA1415_SDLC_8_SC_ES-06284	R-5-50	1654	Sunburn is another cause of skin cancer.
EBA1415_SDLC_8_SC_ES-06284	R-2-4	1655.1	When there is an extreme amount of sun hitting one, their skin cells start to die out, so blood is sent to those areas to help produce new cells.
EBA1415_SDLC_8_SC_ES-06284	R-4-6	1655.2	When there is an extreme amount of sun hitting one, their skin cells start to die out, so blood is sent to those areas to help produce new cells.
EBA1415_SDLC_8_SC_ES-06284	O	1656	Sometimes extreme exposure to the sun can even cause death.//
EBA1415_TFBM_1_SC_ES-05438	R-2-50	1657	The risk of getting skin cancer is by getting closer to the sun and in high risk being around people that do have skin cancer//
EBA1415_TFBM_1_SC_ES-05438	O	1658	Ran out of time
EBA1415_TWNB_3_SC_ES-04989	O	1659	Some humans develop skin cancer because of abnormal skin cells.
EBA1415_TWNB_3_SC_ES-04989	O	1660	The passage stats the "the variety of skin cancer that develops depends on the type of skin cells that reproduces irregularly".
EBA1415_TWNB_3_SC_ES-04989	O	1661	Many people have skin cancer maybe because of heredity.
EBA1415_TWNB_3_SC_ES-04989	O	1662	People can trait irregular skin cells then eventually get skin cancer.
EBA1415_TWNB_3_SC_ES-04989	O	1663	Skin cancer seems like a very rare disease to me.
EBA1415_TWNB_3_SC_ES-04989	O	1664	I have many question such as "Is it contagious?"
EBA1415_TWNB_3_SC_ES-04989	O	1665	or "Are researchers trying to find a cure?".
EBA1415_TWNB_3_SC_ES-04989	O	1666	Also, when before you develop skin cancer what are some symptoms to lead you to wonder you may be developing some kind of disease.
EBA1415_TWNB_3_SC_ES-04989	O	1667	I feel sorry for people with this disease because I know skin cancer causes death.
EBA1415_TWNB_3_SC_ES-04989	R-6-50	1668	Another thing that can cause skin cancer is sunburned skin cells that aren't removed.
EBA1415_TWNB_3_SC_ES-04989	O	1669	The variety of skin cancer that develops depends on the type of skin cell that reproduces irregularly.//
EBA1415_RDCS_1_SC_ES-04694	R-5-50	1670	Skin canser the way you mostly get it is you get it or it passas on to you sunboren is most of the reason why people get skin cancer ar your getting a tan but you fall asleep for to long if you reapity get sunburn you will get your self skin cancer I dont know what curies skin cancer.
EBA1415_RDCS_1_SC_ES-04694	O	1671	Skin canccer is the most common dieases most people whille get.
EBA1415_RDCS_1_SC_ES-04694	O	1672	there are three main varieties of skin cancer: basal cell carcinoma, squamous cell's basal cell crinic squam check your skin for suspicious detection cases can help with detitio skin//
EBA1415_BGJD_2_SC_ES-05736	R-4-RHETORICAL	1673	The different effects that causes skin cancer varies.
EBA1415_BGJD_2_SC_ES-05736	R-4-RHETORICAL	1674	One of the effects is skin damage.
EBA1415_BGJD_2_SC_ES-05736	O	1675	Skin is our bodies largest organ.
EBA1415_BGJD_2_SC_ES-05736	O	1676	We can have skin disorders conditions and diseases.
EBA1415_BGJD_2_SC_ES-05736	O	1677	Skin cancer is caused by uncontrolled growth of abnormal skin cells.
EBA1415_BGJD_2_SC_ES-05736	O	1678	There are 3 different types of skin cancer.
EBA1415_BGJD_2_SC_ES-05736	O	1679	There's basal cell carcinoma, squamous cell carcinoma, and malignant melanoma.
EBA1415_BGJD_2_SC_ES-05736	R-2-50	1680	Another thing that it can lead to skin cancer is direct sunlight.
EBA1415_BGJD_2_SC_ES-05736	R-3-50	1681	Too much uvb radiation can cause skin cancer.
EBA1415_BGJD_2_SC_ES-05736	R-5-50	1682	Sunburn may also cause cancer later in life.
EBA1415_BGJD_2_SC_ES-05736	O	1683	Sunburn is caused by damage to the genetic molecules in skin cells.
EBA1415_BGJD_2_SC_ES-05736	R-5-6	1684	Sunburn happens when the body directs blood to skin to try to repair or remove damaged cells.
EBA1415_BGJD_2_SC_ES-05736	O	1685	The additional blood flow is the reason the skin becomes red.
EBA1415_BGJD_2_SC_ES-05736	R-5-50	1686	Too many sunburns during childhood or adolescence doubles the chances of developing skin cancer later in life.//
EBA1415_TWDG_11_SC_ES-04947	O	1687	There are all different kinds of skin cancer, there is basal cell carcinoma, squamous cell carcinoma skin cancer it's like a skin disorders conditions, and disease skin cancer gives you the maximum chance for successful treatment its most common to cancer changes can help you with detecting skin cancer at its earlier age its like 5 percent of chance.
EBA1415_TWDG_11_SC_ES-04947	R-3-4	1688	Skin cancer cases researchers have found that when the skin is hit with normal amounts of Uvb radiation that rays that causes small amounts of damage to genetic molecules.//
EBA1415_LRBL_4_SC_ES-05165	R-5-50	1689.1	A very common reason why most people get skin cancer is sun burns most people live very close to equator and the closer you are to the equator, the more consistent the direct sunlight will be.
EBA1415_LRBL_4_SC_ES-05165	R-1-2	1689.2	A very common reason why most people get skin cancer is sun burns most people live very close to equator and the closer you are to the equator, the more consistent the direct sunlight will be.
EBA1415_LRBL_4_SC_ES-05165	R-5-50	1690	Children are the ones who get sunburned more than adult, and the more sunburns you have as a child, the greater the risk is of getting skin cancer when you're older./
EBA1415_LRBL_4_SC_ES-05165	R-5-50	1691	Getting skin cancer doesn't have to happen like getting a sunburn.
EBA1415_LRBL_4_SC_ES-05165	O	1692	You can simply just get a disease.
EBA1415_LRBL_4_SC_ES-05165	O	1693	There are three very common varieties of skin cancer, basal cell carcinoma, squamous cell carcinoma, and malignant melonama.
EBA1415_LRBL_4_SC_ES-05165	O	1694	These are all types of uncontrolled growths of abnormal skin cells.
EBA1415_LRBL_4_SC_ES-05165	O	1695	Malignant melanoma is only about 5% of skin cancer but is known for the most deaths from skin cancer./
EBA1415_LRBL_4_SC_ES-05165	O	1696	Skin cancer is caused by the burning is skin by uvb rays, and by simple things such as a disease.//
EBA1415_TWPK_3_SC_ES-06195	R-5-50	1697	You can develope skin cancer in many ways one is by a sun burn.
EBA1415_TWPK_3_SC_ES-06195	R-4-5	1698	sun burn is caused by damage to genetic molecules in skin cells.
EBA1415_TWPK_3_SC_ES-06195	O	1699	Severe sunburn is called sun poisoning, it can lead to infection and shock, in extreme cases, it can even cause death.
EBA1415_TWPK_3_SC_ES-06195	O	1700	There are three main varieties of skin cancer: basel cell carcinoma, squamous cell carcinoma and malignant melanoma.
EBA1415_TWPK_3_SC_ES-06195	O	1701	Together, basal and squamous cell carcinoma makese up approximately 95 percent of skin cancers.
EBA1415_TWPK_3_SC_ES-06195	O	1702	However malignant melanoma is responsible for the most deaths from skin cancer.
EBA1415_TWPK_3_SC_ES-06195	O	1703	Skin cancer is the uncontrolled growth of abnormal skin cells.
EBA1415_TWPK_3_SC_ES-06195	O	1704	The variety of skin cancer that develops depends on the type of skin cell that reproduces irregularly.//
EBA1415_TFHC_1_SC_ES-05946	R-3-50	1705.1	Uvb radiation can cause skin cancer exposure to uvb radiation meaning if you have direct contact to the sun's ray you will be radiation which causes damage to the skin and then you body will remove all of the damage skin but if not removed the damage cell will cause damage to the body and lead to skin cancer.
EBA1415_TFHC_1_SC_ES-05946	R-3-4	1705.2	Uvb radiation can cause skin cancer exposure to uvb radiation meaning if you have direct contact to the sun's ray you will be radiation which causes damage to the skin and then you body will remove all of the damage skin but if not removed the damage cell will cause damage to the body and lead to skin cancer.
EBA1415_TFHC_1_SC_ES-05946	R-4-6	1705.3	Uvb radiation can cause skin cancer exposure to uvb radiation meaning if you have direct contact to the sun's ray you will be radiation which causes damage to the skin and then you body will remove all of the damage skin but if not removed the damage cell will cause damage to the body and lead to skin cancer.
EBA1415_TFHC_1_SC_ES-05946	R-6-50	1705.4	Uvb radiation can cause skin cancer exposure to uvb radiation meaning if you have direct contact to the sun's ray you will be radiation which causes damage to the skin and then you body will remove all of the damage skin but if not removed the damage cell will cause damage to the body and lead to skin cancer.
EBA1415_TFHC_1_SC_ES-05946	R-5-6	1706.1	Even whne you get a sun burn the damage cells have to be removed but the body dosn't always remove all the damage cells and later led to skin cancer.
EBA1415_TFHC_1_SC_ES-05946	R-6-50	1706.2	Even whne you get a sun burn the damage cells have to be removed but the body dosn't always remove all the damage cells and later led to skin cancer.
EBA1415_TFHC_1_SC_ES-05946	R-4-50	1707	I think that damaging the skin greatly can lead to skin cancer.
EBA1415_TFHC_1_SC_ES-05946	O	1708	Even after reading the articles it dosn't say what happen when your born with skin cancer.//
EBA1415_SDLC_8_SC_ES-05453	R-1-50	1709	The risk of developing skin cancer differs due to many reasons.
EBA1415_SDLC_8_SC_ES-05453	R-1-50	1710	First what latitude you live on plays a big role.
EBA1415_SDLC_8_SC_ES-05453	R-1-50	1711.1	The closer you are to the equator the higher risk of you getting skin cancer.
EBA1415_SDLC_8_SC_ES-05453	R-3-50	1711.2	The closer you are to the equator the higher risk of you getting skin cancer.
EBA1415_SDLC_8_SC_ES-05453	R-1-50	1712	So; someone living at 10o latitude would have a higher risk than someone at 50o latitude.
EBA1415_SDLC_8_SC_ES-05453	R-3-50	1713	Another cause is how much Uvb radiation you are exposed to.
EBA1415_SDLC_8_SC_ES-05453	R-3-50	1714	The more Uvb radiation you are exposed to the higher chance of you developing skin cancer.//
EBA1415_TWPK_3_SC_ES-06199	O	1715	You can develop skin cancer in many ways.
EBA1415_TWPK_3_SC_ES-06199	O	1716	Skin cancer is the uncontrolled growth of abnormal skin cells.
EBA1415_TWPK_3_SC_ES-06199	O	1717	The variety of skin cancer that develops depends on the type of skin cell that reproduce irregularly.
EBA1415_TWPK_3_SC_ES-06199	O	1718	There are three main varieties of skin cancer.
EBA1415_TWPK_3_SC_ES-06199	O	1719	Basal cell carcinoma, squamous cell carcinoma, + malignant melanoma.
EBA1415_TWPK_3_SC_ES-06199	O	1720	If you took your skin off + laid it flat it would cover 21 square feet.
EBA1415_TWPK_3_SC_ES-06199	O	1721	The skin is by far the largest body organ.
EBA1415_TWPK_3_SC_ES-06199	O	1722	Skin releases antibacterial substances that assit in the prevention of infection.
EBA1415_TWPK_3_SC_ES-06199	O	1723	Skin is composed in 3 layers.
EBA1415_TWPK_3_SC_ES-06199	O	1724	The outer must protect you from everything.
EBA1415_TWPK_3_SC_ES-06199	O	1725	The middle skin layer is the dermis.
EBA1415_TWPK_3_SC_ES-06199	O	1726	The inner most layer is subcutaneous fat.
EBA1415_TWPK_3_SC_ES-06199	O	1727	UVb radiation is a type of solar radiation.
EBA1415_TWPK_3_SC_ES-06199	R-12-3	1728	Your skin does have some defences against solar radiation.
EBA1415_TWPK_3_SC_ES-06199	O	1729	Melanin is a special pigment produced by epidermis.
EBA1415_TWPK_3_SC_ES-06199	R-11-12	1730.1	Melanin helps protect from solar radiation.
EBA1415_TWPK_3_SC_ES-06199	R-12-3	1730.2	Melanin helps protect from solar radiation.
