File	Relation	SNum	Sentence
EBA1415_TTCM_910_SC_ES-06149	R-3-4	1050	The rays cause small amounts of damage to genetic molecules in the skin cells, however problems arise when there is excessive exposure to Uvb radiation.
EBA1415_TTCM_910_SC_ES-06149	R-5-50	1051	Another way is through sunburn.
EBA1415_TTCM_910_SC_ES-06149	R-4-5	1052	Sunburn is damage to genetic molecules in skin cells, and the reason your skin turns red is because your blood tries to repair your skin that's why it has a reddish appearance.
EBA1415_TTCM_910_SC_ES-06149	R-5-6	1053.1	If sunburned skin cells aren't removed it can result in skin cancer.//
EBA1415_TTCM_910_SC_ES-06149	R-6-50	1053.2	If sunburned skin cells aren't removed it can result in skin cancer.//
EBA1415_TWJB_5_SC_ES-05065	O	1054	So after what I have been or started reading a lot of people have died due to skin cancer.
EBA1415_TWJB_5_SC_ES-05065	O	1055	I never knew some of the parts of our skin.
EBA1415_TWJB_5_SC_ES-05065	O	1056	I learned your skin can turn completely red in the sun.
EBA1415_TWJB_5_SC_ES-05065	O	1057	At first, (before I read this article) I thought it was just a light red, but actually its a dark.
EBA1415_TWJB_5_SC_ES-05065	O	1058	I never, in my life, knew that sun burns can turn into sun poisoning and kill it.
EBA1415_TWJB_5_SC_ES-05065	O	1059	That was very ineresting to learn about.
EBA1415_TWJB_5_SC_ES-05065	O	1060	Something I read and knew about already was that your skin protects you from infections and loss of water in your body.
EBA1415_TWJB_5_SC_ES-05065	O	1061	Last thing for Sun burns is that I believed that sun burns are just processes that happens regularly to the human in the sun.
EBA1415_TWJB_5_SC_ES-05065	O	1062	I'm gald I learned that this something pretty serious.
EBA1415_TWJB_5_SC_ES-05065	O	1063	But I have one question, does it cause skin cancer?
EBA1415_TWJB_5_SC_ES-05065	O	1064	When I first saw the article dealing with latitude and longitude, I was wondering, why was this in here and has nothing to do with science.
EBA1415_TWJB_5_SC_ES-05065	O	1065	I knew most of the stuff that was on there already.
EBA1415_TWJB_5_SC_ES-05065	O	1066	But I saw something new and kind of interesting to me.
EBA1415_TWJB_5_SC_ES-05065	R-1-2	1067	That would be the closer you are to the equator, the more consistent direct sunlight will be.
EBA1415_TWJB_5_SC_ES-05065	O	1068	Which means people closer to the equator needs to be more aware of the dangers of direct sunlight.
EBA1415_TWJB_5_SC_ES-05065	O	1069	So back to the subject on skin.
EBA1415_TWJB_5_SC_ES-05065	R-3-50	1070	I will be telling ways you can probably get skin cancer.
EBA1415_TWJB_5_SC_ES-05065	O	1071	I believe one is by getting an open cut so infections could probably get into your skin.
EBA1415_TWJB_5_SC_ES-05065	O	1072	Even though your skin maybe very protectful, it can't completely protect you from everything.
EBA1415_TWJB_5_SC_ES-05065	R-3-50	1073	One example is a UVb radiation can get into your body and cause an infection.
EBA1415_TWJB_5_SC_ES-05065	O	1074	Your body must be able to fight it.
EBA1415_TWJB_5_SC_ES-05065	O	1075	The three types of skin cancer are basal cell carcinoma, squamous cell carcinoma, and malignant melanoma.
EBA1415_TWJB_5_SC_ES-05065	O	1076	The last one I said is responsible for the most death's from skin cancer.
EBA1415_TWJB_5_SC_ES-05065	O	1077	I hope there's a cure for it.//
EBA1415_TRDJ_11_SC_ES-05721	O	1078	No essay.
EBA1415_TTFW_1_SC_ES-06178	R-1-50	1079.1	The differences of risk of developing skin cancer is your area and how much direct sunlight your area gets.
EBA1415_TTFW_1_SC_ES-06178	R-2-50	1079.2	The differences of risk of developing skin cancer is your area and how much direct sunlight your area gets.
EBA1415_TTFW_1_SC_ES-06178	R-2-50	1080.1	if your area gets a lot of sunlight or you are clsoe to the equator, you would be at a higher risk of skin cancer than someone who lives far away from the equator.
EBA1415_TTFW_1_SC_ES-06178	R-1-50	1080.2	if your area gets a lot of sunlight or you are clsoe to the equator, you would be at a higher risk of skin cancer than someone who lives far away from the equator.
EBA1415_TTFW_1_SC_ES-06178	R-6-50	1081.1	Skin cancer can also be caused by sunburned skin cells that aren't removed.//
EBA1415_TTFW_1_SC_ES-06178	R-5-6	1081.2	Skin cancer can also be caused by sunburned skin cells that aren't removed.//
EBA1415_TWPK_1_SC_ES-05042	R-3-50	1082.1	I think to develop skin cancer I think that a person would have to stay in the UVb Radiation from the Sun.
EBA1415_TWPK_1_SC_ES-05042	R-2-3	1082.2	I think to develop skin cancer I think that a person would have to stay in the UVb Radiation from the Sun.
EBA1415_TWPK_1_SC_ES-05042	R-2-50	1083	Thier are many way's you can get skin cancer from the sun though.
EBA1415_TWPK_1_SC_ES-05042	O	1084	Your skin can only protect so much of your body.
EBA1415_TWPK_1_SC_ES-05042	R-2-3	1085.1	The sun can damage your cell's in your body, because of the radiations and the heat.
EBA1415_TWPK_1_SC_ES-05042	R-3-4	1085.2	The sun can damage your cell's in your body, because of the radiations and the heat.
EBA1415_TWPK_1_SC_ES-05042	O	1086	Thier is also 3 main types of skin cancer, basal cell carcinoma, squamous cell carcinoma, and malignant melanoma.
EBA1415_TWPK_1_SC_ES-05042	O	1087	Skin cancer can come in diffrent shapes and sizes.
EBA1415_TWPK_1_SC_ES-05042	R-5-50	1088	Did you know that you could get skin cancer from a sunburn.
EBA1415_TWPK_1_SC_ES-05042	O	1089	You can, if you still if you still have sunburn cell's.//
EBA1415_TWPK_1_SC_ES-05042	O	1090	Ran out of time.
EBA1415_SERS_1516_SC-5114	O	1091	Skin cancer is the most feared of skin diseases due to no one being completely risk free from it.
EBA1415_SERS_1516_SC-5114	O	1092	It is also the most common form of cancer.
EBA1415_SERS_1516_SC-5114	R-6-50	1093.1	Skin cancer is caused when damaged (sunburned) skin cells aren't removed.
EBA1415_SERS_1516_SC-5114	R-5-6	1093.2	Skin cancer is caused when damaged (sunburned) skin cells aren't removed.
EBA1415_SERS_1516_SC-5114	O	1094	Resulting in abnormal growth in your skin cells.
EBA1415_SERS_1516_SC-5114	R-1-50	1095	And depending on just where you live, your chances of getting skin cancer can be greatly increased.
EBA1415_SERS_1516_SC-5114	R-1-50	1096	Differences that hinder or increase your chances of developing skin cancer include as before mentioned, your location the globe, depending on your latitude the amount of consistent sunlight your area receives varies.
EBA1415_SERS_1516_SC-5114	R-5-50	1097	And even one serious sunburn in childhood or adolescence can double your chances of developing it later in life.
EBA1415_SERS_1516_SC-5114	R-11-50	1098	Also your chances of developing skin cancer also depend on a substance called melanin.
EBA1415_SERS_1516_SC-5114	R-11-12	1099.1	It's a special pigment developed in the epidermis that helps defend you from UVb radiation.
EBA1415_SERS_1516_SC-5114	R-12-3	1099.2	It's a special pigment developed in the epidermis that helps defend you from UVb radiation.
EBA1415_SERS_1516_SC-5114	O	1100	Even though skin cancer can't be completely written off as a threat it can be prevented.
EBA1415_SERS_1516_SC-5114	R-12-3	1101.1	Be sure to check your skin for any strange changes or growths, things like sunscreen also protect you from UVb radiation.
EBA1415_SERS_1516_SC-5114	R-3-50	1101.2	Be sure to check your skin for any strange changes or growths, things like sunscreen also protect you from UVb radiation.
EBA1415_SERS_1516_SC-5114	R-3-50	1102	As they can greatly risk the chances of you developing skin cancer.//
EBA1415_TFHC_1_SC-5939	R-1-50	1103	There are many factors that lead to skin cancer.
EBA1415_TFHC_1_SC-5939	R-1-50	1104	It depends on where you live, what you are exposed to etc.
EBA1415_TFHC_1_SC-5939	R-1-2	1105.1	In the latitude article, it talks about how if people live near the equator, they are more likely to experience skin cancer because they happen to be exposed to the sun more.
EBA1415_TFHC_1_SC-5939	R-2-50	1105.2	In the latitude article, it talks about how if people live near the equator, they are more likely to experience skin cancer because they happen to be exposed to the sun more.
EBA1415_TFHC_1_SC-5939	R-1-50	1106	Even if you don't live near the equator, there is still a chance that you could get it.
EBA1415_TFHC_1_SC-5939	O	1107	In the skin protects you article, it talks about how skin cancer is one of the biggest concerns in the U.S.
EBA1415_TFHC_1_SC-5939	O	1108	This is because in the U.S. the body is exposed UVb radiation.
EBA1415_TFHC_1_SC-5939	R-3-6	1109	Most of the time if the body is exposed to UVb radiation, it would repair itself however if it is very severe you would have to get the abnormal cells removed.
EBA1415_TFHC_1_SC-5939	R-3-50	1110	UVb radiation is a big factor on the causes of skin cancer..
EBA1415_TFHC_1_SC-5939	R-5-6	1111	In the sunburn article, it talks about how if you have had a sunburn more than once in your childhood, the body would have a harder time with repairing the skin because of how damaged the skin cells already are.
EBA1415_TFHC_1_SC-5939	R-4-5	1112.1	In the text it also states that "the amount of damaged genetic molecules can be used as an indicator of sunburn severity."
EBA1415_TFHC_1_SC-5939	R-2-5	1112.2	In the text it also states that "the amount of damaged genetic molecules can be used as an indicator of sunburn severity."
EBA1415_TFHC_1_SC-5939	R-2-5	1113	So the severity depends on how badly you were exposed to the sun and on how much you got a sunburn.
EBA1415_TFHC_1_SC-5939	R-6-50	1114	If you don't remove the badly infected skin cells, it would most likely lead to cancer.
EBA1415_TFHC_1_SC-5939	O	1115	In conclusion there are many factors that could lead to skin cancer and it all depends on your location and how badly you were exposed to something.//
EBA1415_RCGJa_4_SC_ES-04681	O	1116	Skin is our bodies largest organ and it helps protect our body from any dangerous or harmful exposure.
EBA1415_RCGJa_4_SC_ES-04681	R-3-50	1117.1	Skin cancer is usually indicated by some that it is caused by the sun and radiation, which is true.
EBA1415_RCGJa_4_SC_ES-04681	R-2-50	1117.2	Skin cancer is usually indicated by some that it is caused by the sun and radiation, which is true.
EBA1415_RCGJa_4_SC_ES-04681	R-1-2	1118	The amount of direct sunlgiht depends on the location and the closer you are to the equator the more light you will actually get.
EBA1415_RCGJa_4_SC_ES-04681	O	1119	This means that direct sunlight can be really harmful.
EBA1415_RCGJa_4_SC_ES-04681	O	1120	This is important because our skin can't completely protect us from harmful exposure and other different infections that our bodies can contract.//
EBA1415_BLHT_5_SC_ES-05210	R-5-50	1121.1	There is one main reason for developing skin cancer which is too much sun.
EBA1415_BLHT_5_SC_ES-05210	R-2-50	1121.2	There is one main reason for developing skin cancer which is too much sun.
EBA1415_BLHT_5_SC_ES-05210	R-5-50	1122	Also how badly sunburn you get.
EBA1415_BLHT_5_SC_ES-05210	R-1-2	1123	To much sun can be a cause of where you live./
EBA1415_BLHT_5_SC_ES-05210	R-1-2	1124.1	Where you live is a big reason for skin cancer because of the sun.
EBA1415_BLHT_5_SC_ES-05210	R-2-50	1124.2	Where you live is a big reason for skin cancer because of the sun.
EBA1415_BLHT_5_SC_ES-05210	R-2-50	1125	People that live in the South have a higher chance of getting skin cancer.
EBA1415_BLHT_5_SC_ES-05210	O	1126	So the more there is where you live the more uvb radiation there is according to the article Latitude and Direct Sunlight.
EBA1415_BLHT_5_SC_ES-05210	O	1127	People in the South have to be more aware of the affects of to much sun then in the North.
EBA1415_BLHT_5_SC_ES-05210	R-1-2	1128	In the articel it states that "As a rule of thumb, the closer you are to the equator, the more consistent direct sunlight will be."/
EBA1415_BLHT_5_SC_ES-05210	R-5-50	1129.1	Also skin cancer can be caused by a really bad sunburn. "Sunburn is caused by damage to genetic molecules in the skin cells," according to the article Sunburn.
EBA1415_BLHT_5_SC_ES-05210	R-4-5	1129.2	Also skin cancer can be caused by a really bad sunburn. "Sunburn is caused by damage to genetic molecules in the skin cells," according to the article Sunburn.
EBA1415_BLHT_5_SC_ES-05210	R-5-6	1130	Sunburn happens when the body directs blood to the skin to try and remove the damaged cells.
EBA1415_BLHT_5_SC_ES-05210	R-5-50	1131.1	The reason some sunburns turn into skin cancer is because when the damaged skin cells aren't removed it is a cause of a severe sunburn.
EBA1415_BLHT_5_SC_ES-05210	R-5-6	1131.2	The reason some sunburns turn into skin cancer is because when the damaged skin cells aren't removed it is a cause of a severe sunburn.
EBA1415_BLHT_5_SC_ES-05210	R-5-50	1132	When your growing up if you just suffer just one serious sunburn it doubles your chances for getting skin cancer later inlife.
EBA1415_BLHT_5_SC_ES-05210	R-5-50	1133	Also if the person has five or more sunburns./
EBA1415_BLHT_5_SC_ES-05210	R-5-50	1134.1	In conclusion, there is one main reason for developing skin cancer which is too much sun.
EBA1415_BLHT_5_SC_ES-05210	R-2-50	1134.2	In conclusion, there is one main reason for developing skin cancer which is too much sun.
EBA1415_BLHT_5_SC_ES-05210	R-5-50	1135	Also how badly sunburn you get or have gotten.
EBA1415_BLHT_5_SC_ES-05210	R-1-2	1136	To much sun can be a cause of where you live.//
EBA1415_SWAF_6_SC_ES-04842	O	1137	Skin on our bodies is our largest organ it covers every region of our bodies in order to protect our inner tissue from infection and loss of water.
EBA1415_SWAF_6_SC_ES-04842	O	1138	Skin help regulate our body temperature.
EBA1415_SWAF_6_SC_ES-04842	O	1139	Skin cancer is the uncontrolled growth of abnormal skin cells.
EBA1415_SWAF_6_SC_ES-04842	O	1140	The variety ofs kin cancer that develops depends on the type of skin cell that reproduces.
EBA1415_SWAF_6_SC_ES-04842	O	1141	There are three main varieties of skin cancer: basal cell carcinoma, squamous cell carcinoma and malignant melanoma.
EBA1415_SWAF_6_SC_ES-04842	O	1142	Basal and squamous cell carcinomas make up about 95% of skin cancers.
EBA1415_SWAF_6_SC_ES-04842	O	1143	Malignant melanoma only occurs 5 percent of skin cancer cases.//
EBA1415_KYLS_6_SC_ES-5676_9	O	1144	Skin cancer is a very dangerous type of cancer which is very easy to get.
EBA1415_KYLS_6_SC_ES-5676_9	O	1145	People ignore the warnigns to be careful and cautious so they don't get it, but that right there, is a huge mistake.
EBA1415_KYLS_6_SC_ES-5676_9	O	1146	You can get skin cancer easily anywhere.
EBA1415_KYLS_6_SC_ES-5676_9	R-11-50	1147.1	Skin cancer develops from sunburns, Uvb radiation (solar radiation) and not haivng too much melanine.
EBA1415_KYLS_6_SC_ES-5676_9	R-3-50	1147.2	Skin cancer develops from sunburns, Uvb radiation (solar radiation) and not haivng too much melanine.
EBA1415_KYLS_6_SC_ES-5676_9	R-5-50	1147.3	Skin cancer develops from sunburns, Uvb radiation (solar radiation) and not haivng too much melanine.
EBA1415_KYLS_6_SC_ES-5676_9	O	1148	All of these are example as to how it all develops into this deadly disease./
EBA1415_KYLS_6_SC_ES-5676_9	O	1149	The sun is very beautiful, warming, and just pleasant.
EBA1415_KYLS_6_SC_ES-5676_9	O	1150	That is if it's not too strong shinign brightly.
EBA1415_KYLS_6_SC_ES-5676_9	O	1151	Although, sometimes people tend to abuse it and end up laying under it just relaxing.
EBA1415_KYLS_6_SC_ES-5676_9	O	1152	Now this here, is the mitake.
EBA1415_KYLS_6_SC_ES-5676_9	R-5-50	1153.1	Skin cancer, develops from sunburns which damage the skin celsl and leads to skin poisoning.
EBA1415_KYLS_6_SC_ES-5676_9	R-5-4	1153.2	Skin cancer, develops from sunburns which damage the skin celsl and leads to skin poisoning.
EBA1415_KYLS_6_SC_ES-5676_9	R-6-50	1154	Our body knows how to remove the bad cells and replace them with new ones, but when they're too damaged and not removed, skin cancer occurs.
EBA1415_KYLS_6_SC_ES-5676_9	R-5-50	1155	Even if a person only gets one sunburn as a lad, their chances to get the disease increase./
EBA1415_KYLS_6_SC_ES-5676_9	R-3-4	1156	Uvb radiation is a type of solar radiation which damages the skin cells just like the sun.
EBA1415_KYLS_6_SC_ES-5676_9	O	1157	Now this caution goes mostly to people who go to tanning shops.
EBA1415_KYLS_6_SC_ES-5676_9	R-3-4	1158	The rays that are given off from the radiations slowly damage the cells (genetic molecules).
EBA1415_KYLS_6_SC_ES-5676_9	R-3-50	1159	Although, this cancer only occurs if there is excessive use/exposure of this solar radiation.//
EBA1415_KYLS_6_SC_ES-5676_9	O	1160	Didn't get to finish
EBA1415_TRJA_67_SC_ES-06082	R-3-50	1161	There are many things that lead to the risk of developing skin cancer.
EBA1415_TRJA_67_SC_ES-06082	R-3-50	1162.1	One of them is the sun's UV rays.
EBA1415_TRJA_67_SC_ES-06082	R-2-3	1162.2	One of them is the sun's UV rays.
EBA1415_TRJA_67_SC_ES-06082	R-1-2	1163	If you live in certain parts of the world, you can get more or less sun exposure.
EBA1415_TRJA_67_SC_ES-06082	O	1164	If you start to have dark patcheso n the right of a person's eye more than likely it can be caused by basal cell carcinoma.
EBA1415_TRJA_67_SC_ES-06082	O	1165	The sun can cause alot of things to happen to your skin.//
EBA1415_TRDJ_11_SC_ES-05703	O	1166	{It's impossible to read this essay very well; the scanning didn't take}
EBA1415_SDMK_4_SC_ES-05959	O	1167	Skin cancer is a leading problem in the US + the World.
EBA1415_SDMK_4_SC_ES-05959	O	1168	Why is it a problem?
EBA1415_SDMK_4_SC_ES-05959	O	1169	The skin is the largest organ in the body + is the ultimate shield for all vital organs.
EBA1415_SDMK_4_SC_ES-05959	O	1170	The skin helps regulate body temp + water.
EBA1415_SDMK_4_SC_ES-05959	O	1171	So, if there's a danger toward the skin, it can be a major danger to the rest of your body.
EBA1415_SDMK_4_SC_ES-05959	O	1172	There are 3 types of common skin cancer.
EBA1415_SDMK_4_SC_ES-05959	O	1173	There is basal cell carcinoma, squamos cell carcinoma, + malignant melanoma.
EBA1415_SDMK_4_SC_ES-05959	O	1174	Together, baseal + squamos cell carcinoma account for//
EBA1415_TFHC_4_SC_ES-05822	R-3-50	1175	Skin cancer can be caused by UVB radiation.
EBA1415_TFHC_4_SC_ES-05822	R-2-3	1176	This radiation is caused by sunlight.
EBA1415_TFHC_4_SC_ES-05822	R-2-50	1177	The more exposed you are to direct sunlight the more at risk you are of developing skin cancer.
EBA1415_TFHC_4_SC_ES-05822	R-1-2	1178.1	In the text "Latitude and Direct Sunlight" it states that the closer you are to the Equator the more sunlight there will be, this also increasing the amount of UVb radiation.
EBA1415_TFHC_4_SC_ES-05822	R-2-3	1178.2	In the text "Latitude and Direct Sunlight" it states that the closer you are to the Equator the more sunlight there will be, this also increasing the amount of UVb radiation.
EBA1415_TFHC_4_SC_ES-05822	R-3-50	1178.3	In the text "Latitude and Direct Sunlight" it states that the closer you are to the Equator the more sunlight there will be, this also increasing the amount of UVb radiation.
EBA1415_TFHC_4_SC_ES-05822	R-3-50	1179	In turn this gives you a high chance of developing skin cancer.
EBA1415_TFHC_4_SC_ES-05822	R-2-50	1180	A way to decrease your chance of skin cancer is to lessen your exposure to the sun.
EBA1415_TFHC_4_SC_ES-05822	O	1181	According to "Skin cancer and latitude" at about 42oN of the Equater there were around 600,500 skin cancer incidences.
EBA1415_TFHC_4_SC_ES-05822	R-1-50	1182	The number of cases decrease the further north you are from the equator.
EBA1415_TFHC_4_SC_ES-05822	O	1183	If you get a little sunburned you damaged or killed skin cells.
EBA1415_TFHC_4_SC_ES-05822	O	1184	This can cause abnormal cells.
EBA1415_TFHC_4_SC_ES-05822	R-2-4	1185.1	The sun can destroy the cells but the more severe the sunburn the harder it is for the body to destroy all the ??? (damaged) cells.
EBA1415_TFHC_4_SC_ES-05822	R-5-6	1185.2	The sun can destroy the cells but the more severe the sunburn the harder it is for the body to destroy all the ??? (damaged) cells.
EBA1415_TFHC_4_SC_ES-05822	R-6-50	1185.3	The sun can destroy the cells but the more severe the sunburn the harder it is for the body to destroy all the ??? (damaged) cells.
EBA1415_TFHC_4_SC_ES-05822	R-6-50	1186	This gives you a very high chance of developing skin cancer.
EBA1415_TFHC_4_SC_ES-05822	R-5-50	1187	Another factor that increases you chance of developing skin cancer is if you suffer multiple sunburns expesially as a child.
EBA1415_TFHC_4_SC_ES-05822	O	1188	A way to greatly reduce the risk of developing skin cancer is using proper protection such as sunscreen and to limit the amount of exposere you have.//
EBA1415_LVSNa_1_SC_ES-05998	O	1189	In my opinion, I think skin cancer is develop with stages of cancer & shows how bad your cancer is or could get./
EBA1415_LVSNa_1_SC_ES-05998	O	1190	First of all in the text it states "There are 3 types of cancer in this human world which are basal cell carcinoma, squamous melanoma".
EBA1415_LVSNa_1_SC_ES-05998	O	1191	This means that they know which ones are more deadly & it shows that Basal & squamous make up 95% of skin cancer, but is not that deadly.
EBA1415_LVSNa_1_SC_ES-05998	O	1192	Wich the other type of cancer.
EBA1415_LVSNa_1_SC_ES-05998	O	1193	Malignant causes 5% of cancer but is one of the most deadlyest type you could get./
EBA1415_LVSNa_1_SC_ES-05998	R-11-12	1194	Secondly, in the text it states "The advantages of having less melanin is that it is easier for the body to make vitamin D.
EBA1415_LVSNa_1_SC_ES-05998	R-11-12	1195.1	The downisde is that it decreases our chances of protection from UVb radition.
EBA1415_LVSNa_1_SC_ES-05998	R-12-3	1195.2	The downisde is that it decreases our chances of protection from UVb radition.
EBA1415_LVSNa_1_SC_ES-05998	R-3-50	1196	This is important because once our UVb radiation is a bit damage you can go to a big risk of skin cancer.//
EBA1415_TWMD_67_SC_ES-05013	O	1197	What could lead to skin cancer is the cells produce irregularly.
EBA1415_TWMD_67_SC_ES-05013	O	1198	Also when the cells produce irregularly you get an uncontrollable gtrowth of abnormal cells.
EBA1415_TWMD_67_SC_ES-05013	O	1199	You could get it by having too much of direct sunlight.
EBA1415_TWMD_67_SC_ES-05013	R-2-5	1200.1	So the effects of having too much sunlight you could get sunburn which could lead to skin cancer.
EBA1415_TWMD_67_SC_ES-05013	R-5-50	1200.2	So the effects of having too much sunlight you could get sunburn which could lead to skin cancer.
EBA1415_TWMD_67_SC_ES-05013	R-2-3	1201	When the sun shines it's light on you, you are absorbing solar radiation.
EBA1415_TWMD_67_SC_ES-05013	R-3-4	1202	The ture of radiation your absorbing is UVb radiation.
EBA1415_TWMD_67_SC_ES-05013	R-3-4	1203	It causes small amounts of damage to your genetic molecules in the skin cells.//
EBA1415_TRWH_8_SC_ES-06057	R-2-50	1204	Skin cancer is cause by to much sun exposurer.
EBA1415_TRWH_8_SC_ES-06057	R-1-50	1205	Depending on how close you are to they equator you have a greater risk of developing skin cancer.
EBA1415_TRWH_8_SC_ES-06057	O	1206	Skin cancer is the uncontrolled growth of abnormal skin cells.
EBA1415_TRWH_8_SC_ES-06057	O	1207	There are various #'s of skin cancer, such as basal cell carcinoma, squamous cell carcinoma, and malignant melanoma.
EBA1415_TRWH_8_SC_ES-06057	O	1208	These types of cancers develop depending on the type of skin cells that reproduce irregularly.
EBA1415_TRWH_8_SC_ES-06057	R-1-50	1209	Your at more of a risk if your closer to the equator.
EBA1415_TRWH_8_SC_ES-06057	O	1210	The amount of direct sunlight may vary.
EBA1415_TRWH_8_SC_ES-06057	R-1-2	1211	The closer you are to the equator the more consistent direct sunlight.
EBA1415_TRWH_8_SC_ES-06057	R-1-2	1212	The most year round direct sunlight occurs between the Tropic of Cancer (23oN) and Capricorn (23oS).//
EBA1415_TRWH_8_SC_ES-06057	O	1213	didn't finish
EBA1415_RHSGa_2_SC_ES-05074	R-3-50	1214.1	There are about 3 different ways that lead to skin cancer.
EBA1415_RHSGa_2_SC_ES-05074	R-5-50	1214.2	There are about 3 different ways that lead to skin cancer.
EBA1415_RHSGa_2_SC_ES-05074	R-3-50	1215.1	The risk are being exposed to sunlight which then develops sunburn, skin cells producing irregularly, and Uvb radiation./
EBA1415_RHSGa_2_SC_ES-05074	R-5-50	1215.2	The risk are being exposed to sunlight which then develops sunburn, skin cells producing irregularly, and Uvb radiation./
EBA1415_RHSGa_2_SC_ES-05074	R-2-5	1215.3	The risk are being exposed to sunlight which then develops sunburn, skin cells producing irregularly, and Uvb radiation./
EBA1415_RHSGa_2_SC_ES-05074	R-2-5	1216	Being exposed to sunlight for long periods of time can make you develop sunburn or sun poisoning.
EBA1415_RHSGa_2_SC_ES-05074	R-5-6	1217	With sunburn the blood flows towrads that spot to make new healthy skin cells and replace the damaged ones.
EBA1415_RHSGa_2_SC_ES-05074	O	1218	The blood turns skin red.
EBA1415_RHSGa_2_SC_ES-05074	R-6-50	1219	Sometimes the cells are replaced but if not then skin cancer happens./
EBA1415_RHSGa_2_SC_ES-05074	O	1220	I believe when skin cells produce irregularly then skin cancer occurs.
EBA1415_RHSGa_2_SC_ES-05074	O	1221	The cells mutate and either does something good or something bad and in this case its bad.
EBA1415_RHSGa_2_SC_ES-05074	O	1222	Your skin has three layers and when 1 layer is injured then skill cells rebuild that layer.
EBA1415_RHSGa_2_SC_ES-05074	O	1223	Uvb radiation is solar radiation.
EBA1415_RHSGa_2_SC_ES-05074	R-3-4	1224	When skin is hit with a small amount of Uvb radiation little  damage is done.
EBA1415_RHSGa_2_SC_ES-05074	R-11-12	1225.1	Melanin helps protect us from solar radiation.
EBA1415_RHSGa_2_SC_ES-05074	R-12-3	1225.2	Melanin helps protect us from solar radiation.
EBA1415_RHSGa_2_SC_ES-05074	O	1226	So we do have some sort of shield./
EBA1415_RHSGa_2_SC_ES-05074	O	1227	In conclusion these are the differences that lead to the risk of developing skin cancer.
